{
  "schema_version": "1.0.0",
  "meta": {
    "title": "雪夜灯火",
    "language": "zh-CN",
    "model": {
      "provider": "minimax",
      "model_name": "MiniMax-M2.7"
    }
  },
  "series_visual_lock": "腊月寒冬写实风，以冷白雪色与昏黄烛光对比为主调；玄色劲装与月白袄裙构成人物核心视觉辨识；全程自然光源主导（雪光/烛火），低饱和暖灰调性，禁用高饱和霓虹与古装剧惯用的柔光滤镜；整体质感追求电影写实，不设仙侠或赛博元素。",
  "characters": [
    {
      "id": "protagonist_01",
      "name": "沈照夜",
      "role": "protagonist",
      "appearance": "二十四岁，剑眉峰如刃，眼尾微挑，瞳仁深黑，颧骨微立，薄唇轻抿时显凉薄相；惯穿玄色窄袖劲装，腰束银丝绦，指节修长分明，左腕内侧可见一道陈年疤痕；伤在右肩，血污半边衣襟，发丝凌乱带雪。",
      "voice_hint": "低沉男声，嗓音哑涩，语速偏慢，言辞克制带疏离感"
    },
    {
      "id": "protagonist_02",
      "name": "温蘅",
      "role": "protagonist",
      "appearance": "十九岁，眉目清淡，杏眼温润，睫毛细密，脸颊因寒气泛薄红；半旧的月白袄裙，袖口缝线细密工整，发间一根素木簪挽起长发；身形清瘦，步态稳健，提药篓穿雪地时略显吃力。",
      "voice_hint": "轻柔女声，语速较慢，语调平和，像雪落檐角的细碎声响"
    }
  ],
  "locations": [
    {
      "id": "loc_exterior_01",
      "label": "林边荒径与猎户小屋残址",
      "time_of_day": "unknown",
      "mood": "凛寒寂静，暗藏凶险",
      "environment_prompt": "腊月黄昏至入夜，林边荒径积雪没过脚踝，枯枝败叶覆雪，四野惨白；路旁有废弃猎户小屋残址，木墙倾颓；雪地被拖出一道暗红血迹，延伸向枯树根旁；天色灰蓝，雪片纷落，无人造光源。"
    },
    {
      "id": "loc_interior_01",
      "label": "温蘅居所内景",
      "time_of_day": "night",
      "mood": "温暖洁净，与外界风雪形成对比",
      "environment_prompt": "林外半里处小木屋，室内窄小但陈设井然，木质梁柱，刷白墙面；靠墙设有简朴木榻，被褥素净；桌上陶罐药瓶整齐，一盏油灯或蜡烛提供主要光源，烛火摇曳在墙面投出暖黄光晕；窗外风雪呼啸，室内却相对静谧温暖。"
    }
  ]
}